Cites,Authors,Title,Year,Source,Publisher,ArticleURL,CitesURL,GSRank
4,"C Zhu, H Wang, VCM Leung, L Shu…",An evaluation of user importance when integrating social networks and mobile cloud computing,2014,Global …,ieeexplore.ieee.org,http://ieeexplore.ieee.org/abstract/document/7037254/,"https://scholar.google.com/scholar?cites=7103464305854741682&as_sdt=2005&sciodt=0,5&hl=en&num=20",118
38,"CMS Magurawalage, K Yang, L Hu, J Zhang",Energy-efficient and network-aware offloading algorithm for mobile cloud computing,2014,Computer Networks,Elsevier,https://www.sciencedirect.com/science/article/pii/S1389128614003193,"https://scholar.google.com/scholar?cites=14439165540355578622&as_sdt=2005&sciodt=0,5&hl=en&num=20",17
2,"CS Shih, J Chen, YH Wang, N Chang",Heterogeneous and elastic computation framework for mobile cloud computing,2014,International Journal of …,World Scientific,http://www.worldscientific.com/doi/abs/10.1142/S0218194014400051,"https://scholar.google.com/scholar?cites=9447177243483685751&as_sdt=2005&sciodt=0,5&hl=en&num=20",170
0,"CT Huynh, EN Huh",Resource minimization for real-time application scheduling in mobile cloud computing,2014,한국정보과학회 학술발표논문집,dbpia.co.kr,http://www.dbpia.co.kr/Journal/ArticleDetail/NODE06228541,,233
2,"CT Huynh, TD Nguyen, HQ Nguyen…",Cost efficient real-time applications scheduling in mobile cloud computing,2014,Proceedings of the Fifth …,dl.acm.org,https://dl.acm.org/citation.cfm?id=2676609,"https://scholar.google.com/scholar?cites=2393773031391061338&as_sdt=2005&sciodt=0,5&hl=en&num=20",169
5,"D Callegari, E Conte, T Ferreto…",EpiCare—A home care platform based on mobile cloud computing to assist epilepsy diagnosis,2014,"… ), 2014 EAI 4th …",ieeexplore.ieee.org,http://ieeexplore.ieee.org/abstract/document/7015931/,"https://scholar.google.com/scholar?cites=134489432927457908&as_sdt=2005&sciodt=0,5&hl=en&num=20",116
17,"D De, A Mukherjee",Femtocell based economic health monitoring scheme using mobile cloud computing,2014,Advance Computing Conference (IACC) …,ieeexplore.ieee.org,http://ieeexplore.ieee.org/abstract/document/6779354/,"https://scholar.google.com/scholar?cites=14527240286627331628&as_sdt=2005&sciodt=0,5&hl=en&num=20",42
46,"D Dev, KL Baishnab",Notice of Violation of IEEE Publication Principles A Review and Research Towards Mobile Cloud Computing,2014,"Mobile Cloud Computing, Services, and …",ieeexplore.ieee.org,http://ieeexplore.ieee.org/abstract/document/6834971/,"https://scholar.google.com/scholar?cites=6595848375321796206&as_sdt=2005&sciodt=0,5&hl=en&num=20",9
2,"D Koley, S Ghosh",Cloud Computing with CDroid OS based on Fujitsu Server for Mobile Technology,2014,,papers.ssrn.com,https://papers.ssrn.com/sol3/papers.cfm?abstract_id=2873569,"https://scholar.google.com/scholar?cites=17607118675955949333&as_sdt=2005&sciodt=0,5&hl=en&num=20",182
27,"D Kovachev, Y Cao, R Klamma",Building mobile multimedia services: a hybrid cloud computing approach,2014,Multimedia tools and applications,Springer,https://link.springer.com/article/10.1007/s11042-012-1100-6,"https://scholar.google.com/scholar?cites=6457697098820634142&as_sdt=2005&sciodt=0,5&hl=en&num=20",58
1,"D Luobing, P Shen, Z Xiangdong, Z Li",A novel locationbased services architecture based on mobile cloud computing and behavior prediction,2014,,,,"https://scholar.google.com/scholar?cites=2023214899992874677&as_sdt=2005&sciodt=0,5&hl=en&num=20",192
7,"D Mazza, D Tarchi, GE Corazza",A partial offloading technique for wireless mobile cloud computing in smart cities,2014,"… (EuCNC), 2014 European …",ieeexplore.ieee.org,http://ieeexplore.ieee.org/abstract/document/6882623/,"https://scholar.google.com/scholar?cites=14677492048180281712&as_sdt=2005&sciodt=0,5&hl=en&num=20",98
12,"D Meilander, F Glinka, S Gorlatch, L Lin…",Using mobile cloud computing for real-time online applications,2014,… Cloud Computing …,ieeexplore.ieee.org,http://ieeexplore.ieee.org/abstract/document/6834945/,"https://scholar.google.com/scholar?cites=4877437673178890632&as_sdt=2005&sciodt=0,5&hl=en&num=20",66
10,"D Sarddar, R Bose",A mobile cloud computing architecture with easy resource sharing,2014,… Journal of Current Engineering and Technology,inpressco.com,http://inpressco.com/wp-content/uploads/2014/06/Paper91249-1254.pdf,"https://scholar.google.com/scholar?cites=8978550508340115416&as_sdt=2005&sciodt=0,5&hl=en&num=20",73
16,D Tayade,"Mobile cloud computing: Issues, security, advantages, trends",2014,International Journal of Computer Science and …,Citeseer,http://citeseerx.ist.psu.edu/viewdoc/download?doi=10.1.1.660.8874&rep=rep1&type=pdf,"https://scholar.google.com/scholar?cites=9762770635639601963&as_sdt=2005&sciodt=0,5&hl=en&num=20",35
1,"DM Kadibagil, HS Guruprasad",A Survey on Mobile Cloud Computing,2014,International Journal on Recent …,researchgate.net,https://www.researchgate.net/profile/H_S_Guruprasad/publication/308032503_A_Survey_on_Mobile_Cloud_Computing/links/57d7be4f08ae6399a396e59d.pdf,"https://scholar.google.com/scholar?cites=17379932778257886113&as_sdt=2005&sciodt=0,5&hl=en&num=20",202
0,DRR Joan,An Overture of Mobile Cloud Computing and its Applications,2014,i-manager's Journal on Cloud Computing,search.proquest.com,http://search.proquest.com/openview/889deb9d93fd022e05946406d03697ab/1?pq-origsite=gscholar&cbl=2042733,,235
4,"DS AbdElminaam, HMA Kader…",Increase the Performance of Mobile Smartphones using Partition and Migration of Mobile Applications to Cloud Computing,2014,… of Electronics and …,ijeie.jalaxy.com.tw,http://ijeie.jalaxy.com.tw/contents/ijeie-v1-n1/ijeie-v1-n1.pdf#page=37,"https://scholar.google.com/scholar?cites=13875023638307805315&as_sdt=2005&sciodt=0,5&hl=en&num=20",148
12,"E Cerqueira, E Lee, JT Weng, JH Lim…",Recent advances and challenges in human-centric multimedia mobile cloud computing,2014,Computing …,ieeexplore.ieee.org,http://ieeexplore.ieee.org/abstract/document/6785339/,"https://scholar.google.com/scholar?cites=9220236775247365221&as_sdt=2005&sciodt=0,5&hl=en&num=20",54
16,"F AlShahwan, M Faisal",Mobile cloud computing for providing complex mobile web services,2014,"Mobile Cloud Computing, Services …",ieeexplore.ieee.org,http://ieeexplore.ieee.org/abstract/document/6834948/,"https://scholar.google.com/scholar?cites=2763187032472960316&as_sdt=2005&sciodt=0,5&hl=en&num=20",43
4,"F Pop, OM Citoteanu, C Dobre…",Resource trust management in auto-adaptive overlay network for mobile cloud computing,2014,Parallel and Distributed …,ieeexplore.ieee.org,http://ieeexplore.ieee.org/abstract/document/6900215/,"https://scholar.google.com/scholar?cites=5909540501431873081&as_sdt=2005&sciodt=0,5&hl=en&num=20",125
65,"F Xia, F Ding, J Li, X Kong, LT Yang, J Ma",Phone2Cloud: Exploiting computation offloading for energy saving on smartphones in mobile cloud computing,2014,Information Systems Frontiers,Springer,https://link.springer.com/article/10.1007/s10796-013-9458-1,"https://scholar.google.com/scholar?cites=15195279179693152118&as_sdt=2005&sciodt=0,5&hl=en&num=20",11
2,"G Abdullah, NG Mokatder",A review on interworking and mobility techniques for seamless connectivity in mobile cloud computing [J],2014,Journal of Network and Computer Applications,,,"https://scholar.google.com/scholar?cites=12907819754865608489&as_sdt=2005&sciodt=0,5&hl=en&num=20",179
0,"G Kamboj, N Kaushik","Mobile Cloud Computing: concept, research trends and open issues",2014,International Journal of Advanced …,search.proquest.com,http://search.proquest.com/openview/ebebc1a345547ad4a4ba0b815305877d/1?pq-origsite=gscholar&cbl=1606379,,243
6,"G Kulkarni, R Shelke, PBN Patil…",Optimization in Mobile Cloud Computing for Cloud Based Health Application,2014,"… (CSNT), 2014 Fourth …",ieeexplore.ieee.org,http://ieeexplore.ieee.org/abstract/document/6821461/,"https://scholar.google.com/scholar?cites=17469896395803377537&as_sdt=2005&sciodt=0,5&hl=en&num=20",114
10,"G Kulkarni, R Shelke, R Palwe…",Mobile cloud computing-bring your own device,2014,"… (CSNT), 2014 Fourth …",ieeexplore.ieee.org,http://ieeexplore.ieee.org/abstract/document/6821460/,"https://scholar.google.com/scholar?cites=15450409908901608071&as_sdt=2005&sciodt=0,5&hl=en&num=20",70
2,"G Kumar, E Jain, S Goel…","Mobile Cloud Computing Architecture, Application Model, and Challenging Issues",2014,"… Networks (CICN), 2014 …",ieeexplore.ieee.org,http://ieeexplore.ieee.org/abstract/document/7065557/,"https://scholar.google.com/scholar?cites=16396483276861102838&as_sdt=2005&sciodt=0,5&hl=en&num=20",156
1,"G Lee, H Ko, S Pack",Proxy-based aggregated synchronization scheme in mobile cloud computing,2014,Computer Communications Workshops …,ieeexplore.ieee.org,http://ieeexplore.ieee.org/abstract/document/6849218/,"https://scholar.google.com/scholar?cites=9577575271400301126&as_sdt=2005&sciodt=0,5&hl=en&num=20",196
2,"G Sadasivaprasad, DK Rajagopal, DK Prahladarao",Dynamic Resource Allocation In Road Transport Sector Using Mobile Cloud Computing Techniques,2014,International Journal of …,,,"https://scholar.google.com/scholar?cites=4486022813045670592&as_sdt=2005&sciodt=0,5&hl=en&num=20",174
1,"G Subramanian, SP Reddy",Mobile Cloud Computing System Design for Continuous Monitoring of Patient in Hospitals,2014,International Conference on Technology and Business …,,,"https://scholar.google.com/scholar?cites=4522812632974955812&as_sdt=2005&sciodt=0,5&hl=en&num=20",259
0,"G Wang, W Cui",Mobile Internet Computing Architecture Based on Cloud Computing,2014,Proceedings of the 2012 International Conference on …,Springer,https://link.springer.com/chapter/10.1007/978-1-4614-3872-4_212,,228
0,"G Wei, L Joan",Investigation into Mobile Learning Framework in Cloud Computing Platform,2014,,eprints.hud.ac.uk,http://eprints.hud.ac.uk/21809/1/Investigation_into_Mobile_Learning_Framework_in_Cloud_Computing_Platform_CD_amends.pdf,,328
6,"G Xi, X Zhang, K Qu",On adaptive live streaming in mobile cloud computing environments with D2D cooperation,2014,"Telecommunications (ICT), 2014 21st …",ieeexplore.ieee.org,http://ieeexplore.ieee.org/abstract/document/6845148/,"https://scholar.google.com/scholar?cites=8298033072916850889&as_sdt=2005&sciodt=0,5&hl=en&num=20",106
3,"H Bi, E Gelenbe",A cooperative emergency navigation framework using mobile cloud computing,2014,Information Sciences and Systems 2014,Springer,https://link.springer.com/chapter/10.1007/978-3-319-09465-6_5,"https://scholar.google.com/scholar?cites=11993689263445182152&as_sdt=2005&sciodt=0,5&hl=en&num=20",137
10,"H Routaib, E Badidi, M Elmachkour…",Modeling and evaluating a cloudlet-based architecture for mobile cloud computing,2014,"… (SITA-14), 2014 9th …",ieeexplore.ieee.org,http://ieeexplore.ieee.org/abstract/document/6847290/,"https://scholar.google.com/scholar?cites=7639511788585809924&as_sdt=2005&sciodt=0,5&hl=en&num=20",69
0,"H Suo, CJ Huang",Issues and Current Solutions of Mobile Cloud Computing,2014,Applied Mechanics and Materials,Trans Tech Publ,https://www.scientific.net/AMM.556-562.6251,,255
1,"H Takabi, ST Zargar, JBD Joshi",Mobile Cloud Computing and Its Security and Privacy Challenges,2014,"Security, Privacy, Trust, and …",books.google.com,https://books.google.com/books?hl=en&lr=&id=IfNGAwAAQBAJ&oi=fnd&pg=PA384&dq=+%22mobile+cloud+computing%22&ots=N5CJGn0l_-&sig=i2m8SLd5lrzWmPF-gYTVHHdOfMA,"https://scholar.google.com/scholar?cites=5784602050991384937&as_sdt=2005&sciodt=0,5&hl=en&num=20",219
15,"H Wu, D Huang",Modeling multi-factor multi-site risk-based offloading for mobile cloud computing,2014,"… and Service Management (CNSM), 2014 10th …",ieeexplore.ieee.org,http://ieeexplore.ieee.org/abstract/document/7014164/,"https://scholar.google.com/scholar?cites=14215074082427580891&as_sdt=2005&sciodt=0,5&hl=en&num=20",57
6,"H Wu, K Wolter",Dynamic transmission scheduling and link selection in mobile cloud computing,2014,International Conference on Analytical and Stochastic …,Springer,https://link.springer.com/chapter/10.1007/978-3-319-08219-6_5,"https://scholar.google.com/scholar?cites=9761534835962101004&as_sdt=2005&sciodt=0,5&hl=en&num=20",112
6,"H Yadav, M Dave",Secure data storage operations with verifiable outsourced decryption for mobile cloud computing,2014,Recent Advances and Innovations in …,ieeexplore.ieee.org,http://ieeexplore.ieee.org/abstract/document/6909236/,"https://scholar.google.com/scholar?cites=12669917560296226982&as_sdt=2005&sciodt=0,5&hl=en&num=20",97
0,HA Turner,"Optimizing, Testing, and Securing Mobile Cloud Computing Systems for Data Aggregation and Processing",2014,,search.proquest.com,http://search.proquest.com/openview/1b225ae6b5a6824cb8687cc9d4c97494/1?pq-origsite=gscholar&cbl=18750&diss=y,,265
6,"HJ La, SD Kim",A taxonomy of offloading in mobile cloud computing,2014,"… and Applications (SOCA), 2014 IEEE 7th …",ieeexplore.ieee.org,http://ieeexplore.ieee.org/abstract/document/6978603/,"https://scholar.google.com/scholar?cites=11190332690461856007&as_sdt=2005&sciodt=0,5&hl=en&num=20",121
7,"HMA Kader, MM Hadhoud, SM El-Sayed…",Performance evaluation of new hybrid encryption algorithms to be used for mobile cloud computing,2014,International Journal of …,Citeseer,http://citeseerx.ist.psu.edu/viewdoc/download?doi=10.1.1.434.3787&rep=rep1&type=pdf,"https://scholar.google.com/scholar?cites=8457284018747851409&as_sdt=2005&sciodt=0,5&hl=en&num=20",93
3,"HMA Kader, MM Hadhoud…",Increasing The Performance Of Mobile Smartphones Using Partition And Migration Of Mobile Applications To Cloud Computing,2014,International …,pdfs.semanticscholar.org,https://pdfs.semanticscholar.org/5af1/00595efddbde995ed4ce5aa28451ead66332.pdf,"https://scholar.google.com/scholar?cites=7804302278276949807&as_sdt=2005&sciodt=0,5&hl=en&num=20",151
0,HRM Alwis,Towards Energy Effective Hybrid Execution in Mobile Cloud Computing,2014,,documents.ucsc.lk,http://documents.ucsc.lk/jspui/handle/123456789/2461,,250
11,"I Al Rassan, H AlShaher",Securing mobile cloud computing using biometric authentication (SMCBA),2014,Computational Science and …,ieeexplore.ieee.org,http://ieeexplore.ieee.org/abstract/document/6822100/,"https://scholar.google.com/scholar?cites=2257366034996887588&as_sdt=2005&sciodt=0,5&hl=en&num=20",71
0,I Andrianopoulos,Mobile cloud computing services,2014,,ΤΕΙ Πειραιά,,,290
4,"I Ayadi, S Noëmie",Adaptive provisioning of connectivity-as-a-service for mobile cloud computing,2014,"Mobile Cloud Computing, Services, and …",ieeexplore.ieee.org,http://ieeexplore.ieee.org/abstract/document/6834959/,"https://scholar.google.com/scholar?cites=3752736292921723459&as_sdt=2005&sciodt=0,5&hl=en&num=20",117
0,I Ghavam,Comprehensive Experimental Analysis on Different Specification of Mobile Augmentation in Mobile Cloud Computing,2014,,researchgate.net,https://www.researchgate.net/profile/Iman_Ghavam2/publication/273000380_Comprehensive_Experimental_Analysis_on_Different_Specification_of_Mobile_Augmentation_in_Mobile_Cloud_Computing/links/54f4904c0cf2ba6150636095.pdf,,334
35,"I Khalil, A Khreishah, M Azeem",Consolidated Identity Management System for secure mobile cloud computing,2014,Computer Networks,Elsevier,https://www.sciencedirect.com/science/article/pii/S1389128614001194,"https://scholar.google.com/scholar?cites=3160650331553027626&as_sdt=2005&sciodt=0,5&hl=en&num=20",20
4,"IA Elgendy, M El-kawkagy…",Improving the performance of mobile applications using cloud computing,2014,Informatics and Systems …,ieeexplore.ieee.org,http://ieeexplore.ieee.org/abstract/document/7036687/,"https://scholar.google.com/scholar?cites=8300092092952089808&as_sdt=2005&sciodt=0,5&hl=en&num=20",145
0,J Nie,Practice and Development of Cloud Computing-Based Mobile Teaching Management and Evaluation System in Vocational Colleges,2014,"Computational Intelligence and Security (CIS), 2014 …",ieeexplore.ieee.org,http://ieeexplore.ieee.org/abstract/document/7017002/,,310
32,"J Song, Y Cui, M Li, J Qiu…",Energy-traffic tradeoff cooperative offloading for mobile cloud computing,2014,Quality of Service (IWQoS) …,ieeexplore.ieee.org,http://ieeexplore.ieee.org/abstract/document/6914329/,"https://scholar.google.com/scholar?cites=4267228923905387168&as_sdt=2005&sciodt=0,5&hl=en&num=20",23
118,"J Wan, D Zhang, Y Sun, K Lin, C Zou, H Cai",VCMIA: a novel architecture for integrating vehicular cyber-physical systems and mobile cloud computing,2014,Mobile Networks and …,Springer,https://link.springer.com/article/10.1007/s11036-014-0499-6,"https://scholar.google.com/scholar?cites=8490926995873923287&as_sdt=2005&sciodt=0,5&hl=en&num=20",7
10,"J Zhang, Y Sun, L Zhu, X Qiao",A synergetic mechanism for digital library service in mobile and cloud computing environment,2014,Personal and Ubiquitous Computing,Springer,https://link.springer.com/article/10.1007/s00779-014-0798-8,"https://scholar.google.com/scholar?cites=6498231540558230653&as_sdt=2005&sciodt=0,5&hl=en&num=20",105
1,"J Zhou, H Zhu, M Ylianttila, M Rautiainen",Mobile Multimedia Cloud Computing.,2014,,books.google.com,https://books.google.com/books?hl=en&lr=&id=WmHOBQAAQBAJ&oi=fnd&pg=PA1&dq=+%22mobile+cloud+computing%22&ots=oH50dyvMxm&sig=T5Pb2iC4DD8uiMUJG1alYlaQoHo,"https://scholar.google.com/scholar?cites=13448229891018464356&as_sdt=2005&sciodt=0,5&hl=en&num=20",226
3,"JAL Ferreira, AR da Silva",Mobile cloud computing,2014,Open Journal of Mobile Computing and …,academia.edu,http://www.academia.edu/download/41565198/V1N2-005.pdf,"https://scholar.google.com/scholar?cites=9627023307195580860&as_sdt=2005&sciodt=0,5&hl=en&num=20",6
1,"JEF Costa, JJPC Rodrigues","Mobile cloud computing: Technologies, services, and applications",2014,Mobile Networks and Cloud Computing …,igi-global.com,https://www.igi-global.com/chapter/mobile-cloud-computing/90105,"https://scholar.google.com/scholar?cites=2682530198887664888&as_sdt=2005&sciodt=0,5&hl=en&num=20",188
4,"JF Bravo-Torres, M López-Nores…",Leveraging ad-hoc networking and mobile cloud computing to exploit short-lived relationships among users on the move,2014,… on Intelligent Cloud …,Springer,https://link.springer.com/chapter/10.1007/978-3-319-19848-4_6,"https://scholar.google.com/scholar?cites=5749467742612667012&as_sdt=2005&sciodt=0,5&hl=en&num=20",126
2,"JK Aulakh, S Sharma, M Arora",Mobile Cloud Computing Security Issues: Overview,2014,International Journal of Advanced …,ijarcet.org,http://ijarcet.org/wp-content/uploads/IJARCET-VOL-3-ISSUE-5-1722-1726.pdf,"https://scholar.google.com/scholar?cites=6014502838972763653&as_sdt=2005&sciodt=0,5&hl=en&num=20",149
5,JK Bae," Study on the Effects of Perceived Privacy, Perceived Security Perceived Enjoyment, on Continuance Usage Intention in Mobile Cloud Computing",2014,The E-Business Studies,,,"https://scholar.google.com/scholar?cites=14359387160787291918&as_sdt=2005&sciodt=0,5&hl=en&num=20",115
4,"JP Champati, B Liang",Energy compensated cloud assistance in mobile cloud computing,2014,Computer Communications Workshops …,ieeexplore.ieee.org,http://ieeexplore.ieee.org/abstract/document/6849264/,"https://scholar.google.com/scholar?cites=12176607115421561146&as_sdt=2005&sciodt=0,5&hl=en&num=20",123
20,"JS Park, H Kim, YS Jeong, E Lee",Two‐phase grouping‐based resource management for big data processing in mobile cloud computing,2014,International Journal of …,Wiley Online Library,http://onlinelibrary.wiley.com/doi/10.1002/dac.2627/full,"https://scholar.google.com/scholar?cites=14335267426309952494&as_sdt=2005&sciodt=0,5&hl=en&num=20",32
0,JY Liu,A Lightweight Algorithm for Partitioning Elastic Mobile Application in Mobile Cloud Computing,2014,,"Fakulti Sains Komputer, Universiti …",,,315
0,"JZ Ping, LL Yu, Q Wang, XF Wu",Effective Analysis Method of Mobile Cloud Computing,2014,Applied Mechanics and Materials,Trans Tech Publ,https://www.scientific.net/AMM.644-650.1980,,274
0,"K Kaur, R Kaur",Modified keyless user defined encryption system for Mobile Cloud Computing environment,2014,Journal of Emerging Technologies and Innovative …,jetir.org,http://www.jetir.org/view?paper=JETIR1406005,,260
7,"K Kaur, S Sharma, M Arora",Mobile cloud computing techniques: A review,2014,… Journal of Advanced Research in Computer …,ijarcet.org,http://ijarcet.org/wp-content/uploads/IJARCET-VOL-3-ISSUE-5-1734-1738.pdf,"https://scholar.google.com/scholar?cites=10880590153592581008&as_sdt=2005&sciodt=0,5&hl=en&num=20",94
1,"K Kim, S Yeom",Method for Mobile node in Cloud Computing Environments,2014,Journal of The Korea Society of Computer and …,koreascience.or.kr,http://www.koreascience.or.kr/article/ArticleFullRecord.jsp?cn=CPTSCQ_2014_v19n2_67,"https://scholar.google.com/scholar?cites=14377805170853576048&as_sdt=2005&sciodt=0,5&hl=en&num=20",275
0,"K Lee, S Rho, SW Lee",A Method of Extracting Ontology Module Using Concept Relations for Sharing Knowledge in Mobile Cloud Computing Environment,2014,The Scientific World Journal,hindawi.com,https://www.hindawi.com/journals/tswj/2014/382797/abs/,,323
11,"K Mitra, C Ahlund",A mobile cloud computing system for emergency management,2014,IEEE Cloud Computing,ieeexplore.ieee.org,http://ieeexplore.ieee.org/abstract/document/7057583/,"https://scholar.google.com/scholar?cites=1311019158649481107&as_sdt=2005&sciodt=0,5&hl=en&num=20",68
0,"K Venkateswarlu, MS Lakshmi, SP Kumar",Energy Saving For Mobile Users Using Cloud Computing Via S3,2014,,pdfs.semanticscholar.org,https://pdfs.semanticscholar.org/0adc/53e6cfdb70ace6e10c1ceb785c6bef6b8bcd.pdf,,249
18,"K Xu, Y Zhang, X Shi, H Wang…",Online combinatorial double auction for mobile cloud computing markets,2014,"… (IPCCC), 2014 IEEE …",ieeexplore.ieee.org,http://ieeexplore.ieee.org/abstract/document/7017103/,"https://scholar.google.com/scholar?cites=178178856854552801&as_sdt=2005&sciodt=0,5&hl=en&num=20",44
2,"K Zhan, CH Lung, P Srivastava",A green analysis of mobile cloud computing applications,2014,Proceedings of the 29th Annual ACM …,dl.acm.org,https://dl.acm.org/citation.cfm?id=2555069,"https://scholar.google.com/scholar?cites=8654826346078391300&as_sdt=2005&sciodt=0,5&hl=en&num=20",158
12,"KE Psannis, S Xinogalos, A Sifaleras",Convergence of Internet of things and mobile cloud computing,2014,Systems Science & Control …,Taylor & Francis,http://www.tandfonline.com/doi/abs/10.1080/21642583.2014.913213,"https://scholar.google.com/scholar?cites=14430417700025841847&as_sdt=2005&sciodt=0,5&hl=en&num=20",65
1,"KK Hiran, R Doshi",The Proliferation of Smart Devices on Mobile Cloud Computing,2014,,forskningsdatabasen.dk,http://www.forskningsdatabasen.dk/en/catalog/2291944318,"https://scholar.google.com/scholar?cites=3752269723180570593&as_sdt=2005&sciodt=0,5&hl=en&num=20",187
1,"L Boroumand, M Shiraz, A Gani, S Khan, S Shah",A review on port-knocking authentication methods for mobile cloud computing,2014,… for Mobile Cloud Computing …,,,"https://scholar.google.com/scholar?cites=10819786518325448883&as_sdt=2005&sciodt=0,5&hl=en&num=20",191
2,"L Boroumand, M Shiraz, A Gani, S Khan…",Virtualization Technique for port-knocking in mobile cloud computing,2014,Int. J. Advanced Soft …,researchgate.net,https://www.researchgate.net/profile/Laleh_Boroumand/publication/261798946_Virtualization_Technique_for_Port_Knocking_in_Mobile_Cloud_Computing/links/0f3175358b8668c150000000/Virtualization-Technique-for-Port-Knocking-in-Mobile-Cloud-Computing.pdf,"https://scholar.google.com/scholar?cites=645981157073208892&as_sdt=2005&sciodt=0,5&hl=en&num=20",172
5,"L Goel, V Jain",A Review on Security Issues and Challenges of Mobile Cloud Computing and Preventive Measures,2014,International Conference on Advances in …,pdfs.semanticscholar.org,https://pdfs.semanticscholar.org/fd5d/5a1f4a0017d6ad837353f2407d1b3c8eece3.pdf,"https://scholar.google.com/scholar?cites=6873892994921280854&as_sdt=2005&sciodt=0,5&hl=en&num=20",103
9,"L Kumar, N Malik, G Agghi, A Anand",Mobile cloud computing,2014,IJRIT International Journal …,sites.google.com,https://sites.google.com/a/ijrit.com/papers/sept/V2I9244.pdf,"https://scholar.google.com/scholar?cites=4274811690303495319&as_sdt=2005&sciodt=0,5&hl=en&num=20",2
0,L Pallavi,Mobile Cloud Computing: The Emerging Computing Paradigm for the 21st century,2014,International Journal of Advanced Research in …,search.proquest.com,http://search.proquest.com/openview/63cd3445adb3e36491b7f898f0d837a9/1?pq-origsite=gscholar&cbl=1606379,,309
5,"L Wang, CA Alexander",Telemedicine based on mobile devices and mobile cloud computing,2014,International Journal of Cloud …,search.proquest.com,http://search.proquest.com/openview/352bc50e9a679a0e07e36990cd06c93b/1?pq-origsite=gscholar&cbl=1686342,"https://scholar.google.com/scholar?cites=16781459200257263356&as_sdt=2005&sciodt=0,5&hl=en&num=20",110
24,"L Wang, Y Cui, I Stojmenovic, X Ma, J Song",Energy efficiency on location based applications in mobile cloud computing: a survey,2014,Computing,Springer,https://link.springer.com/article/10.1007/s00607-013-0334-0,"https://scholar.google.com/scholar?cites=16880692658200004452&as_sdt=2005&sciodt=0,5&hl=en&num=20",30
10,"L Yu, WT Tsai, X Wei, J Gao…",Modeling and analysis of mobile cloud computing based on bigraph theory,2014,… Cloud Computing …,ieeexplore.ieee.org,http://ieeexplore.ieee.org/abstract/document/6834947/,"https://scholar.google.com/scholar?cites=3437513094084384316&as_sdt=2005&sciodt=0,5&hl=en&num=20",75
0,LB Jazi,A Port Knocking Authentication Method for Mobile Cloud Computing,2014,,"Fakulti Sains Komputer, Universiti …",,,264
0,"LE Tudoran, BS Ionescu",The use of accounting apps via mobile Cloud computing in Romania,2014,Annales Universitatis Apulensis …,search.proquest.com,http://search.proquest.com/openview/518aab7d1c0b53d6fbaf63472687938d/1?pq-origsite=gscholar&cbl=276234,,302
