Cites,Authors,Title,Year,Source,Publisher,ArticleURL,CitesURL,GSRank
1,"H Raei, N Yazdani, R Shojaee",Modeling and performance analysis of cloudlet in Mobile Cloud Computing,2017,Performance Evaluation,Elsevier,https://www.sciencedirect.com/science/article/pii/S0166531616300281,"https://scholar.google.com/scholar?cites=1207173840830043119&as_sdt=2005&sciodt=0,5&hl=en&num=20",198
0,"H Routaib, E Sabir, E Badidi, M Elkoutbi",Latency delay evaluation for cloudlet-based architectures in mobile cloud computing environments,2017,Cloud and Fog Computing in 5G …,IET,,,269
5,"H Shah-Mansouri, VWS Wong…",Joint optimal pricing and task scheduling in mobile cloud computing systems,2017,IEEE Transactions on …,ieeexplore.ieee.org,http://ieeexplore.ieee.org/abstract/document/7934437/,"https://scholar.google.com/scholar?cites=3738778921790885059&as_sdt=2005&sciodt=0,5&hl=en&num=20",35
0,"H Wu, S Deng, W Li, J Yin, Q Yang, Z Wu…",Revenue-Driven Service Provisioning for Resource Sharing in Mobile Cloud Computing,2017,… Conference on Service …,Springer,https://link.springer.com/chapter/10.1007/978-3-319-69035-3_46,,279
0,"H Yeganeh, A Salahi, M Pourmina",Reduction of Energy Consumption in Mobile Cloud Computing by‎ Classification of Demands and Executing in Different Data Centers,2017,AUT Journal of Electrical …,eej.aut.ac.ir,http://eej.aut.ac.ir/article_2689.html,,148
1,"H Zhijun, E Robson, A Boukerche",Towards efficient data access in mobile cloud computing using pre-fetching and caching,2017,"… (ICC), 2017 IEEE …",ieeexplore.ieee.org,http://ieeexplore.ieee.org/abstract/document/7997078/,"https://scholar.google.com/scholar?cites=8810803696900444397&as_sdt=2005&sciodt=0,5&hl=en&num=20",288
0,HA Yifter,SERVICE CONVERGENCE ISSUE IN MOBILE CLOUD COMPUTING Hagos Alemseged Yifter,2017,International Journal of Multidisciplinary …,ijmer.s3.amazonaws.com,http://ijmer.s3.amazonaws.com/pdf/volume6/volume6-issue7(3)-2017.pdf#page=108,,217
0,"HK Shaikha, AB Sallow",Mobile Cloud Computing: A Review,2017,Academic Journal of Nawroz …,journals.nawroz.edu.krd,http://journals.nawroz.edu.krd/index.php/ajnu/article/view/96,,248
0,"HR Nikkhah, R Sabherwal",A Privacy-Security Model of Mobile Cloud Computing Applications,2017,,aisel.aisnet.org,http://aisel.aisnet.org/icis2017/Security/Presentations/17/,,196
0,"HR Nikkhah, R Sabherwal",Mobile Cloud-Computing Applications: A Privacy Cost-Benefit Model,2017,,aisel.aisnet.org,http://aisel.aisnet.org/amcis2017/InformationSystems/Presentations/11/,,289
0,"HW van der Westhuizen, GP Hancke",Mobile cloud computing and application program interfaces—A review,2017,"AFRICON, 2017 IEEE",ieeexplore.ieee.org,http://ieeexplore.ieee.org/abstract/document/8095716/,,235
3,"I Indu, PMR Anand, SP Shaji",Secure File Sharing Mechanism and Key Management for Mobile Cloud Computing Environment,2017,Indian Journal of Science and Technology,indjst.org,http://www.indjst.org/index.php/indjst/article/view/89496,"https://scholar.google.com/scholar?cites=3685820466064878575&as_sdt=2005&sciodt=0,5&hl=en&num=20",41
0,"J Byun, TE Sung, H Park","A network analysis of strategic alliance drivers in ICT open ecosystem: with focus on mobile, cloud computing, and multimedia",2017,Multimedia Tools and Applications,Springer,https://link.springer.com/article/10.1007/s11042-017-5059-1,,187
0,J Li,Efficient data and application offloading in mobile cloud computing,2017,,ira.lib.polyu.edu.hk,http://ira.lib.polyu.edu.hk/handle/10397/71575,,102
19,"J Li, L Huang, Y Zhou, S He…",Computation partitioning for mobile cloud computing in a big data environment,2017,IEEE Transactions on …,ieeexplore.ieee.org,http://ieeexplore.ieee.org/abstract/document/7814232/,"https://scholar.google.com/scholar?cites=11425542417414309387&as_sdt=2005&sciodt=0,5&hl=en&num=20",12
0,"J Li, Z Guan, X Du, Z Zhang, J Wu",An efficient encryption scheme with verifiable outsourced decryption in mobile cloud computing,2017,"… (ICC), 2017 IEEE …",ieeexplore.ieee.org,http://ieeexplore.ieee.org/abstract/document/7996492/,,234
0,"J Niu, S Wang, W Niu, M Atiquzzaman",User-aware partitioning algorithm for mobile cloud computing based on maximum graph cuts,2017,Computer Networks,Elsevier,https://www.sciencedirect.com/science/article/pii/S1389128617303626,,145
0,"J Shao, Y Zhu, Q Ji",Efficient Decentralized Attribute-Based Encryption with Outsourced Computation for Mobile Cloud Computing,2017,Ubiquitous Computing and …,ieeexplore.ieee.org,https://ieeexplore.ieee.org/abstract/document/8367297/,,180
8,"J Shuja, A Gani, A Naveed, E Ahmed…",Case of arm emulation optimization for offloading mechanisms in mobile cloud computing,2017,Future Generation …,Elsevier,https://www.sciencedirect.com/science/article/pii/S0167739X16301558,"https://scholar.google.com/scholar?cites=10689812235334120393&as_sdt=2005&sciodt=0,5&hl=en&num=20",18
5,"J Wang, J Peng, Y Wei, D Liu, J Fu",Adaptive application offloading decision and transmission scheduling for mobile cloud computing,2017,China Communications,ieeexplore.ieee.org,http://ieeexplore.ieee.org/abstract/document/7897332/,"https://scholar.google.com/scholar?cites=14288146427048464009&as_sdt=2005&sciodt=0,5&hl=en&num=20",30
4,"J Zhang, Z Zhang, H Guo",Towards secure data distribution systems in mobile cloud computing,2017,IEEE Transactions on Mobile …,ieeexplore.ieee.org,http://ieeexplore.ieee.org/abstract/document/7887666/,"https://scholar.google.com/scholar?cites=10177788372433181887&as_sdt=2005&sciodt=0,5&hl=en&num=20",56
0,"J Zhang, Z Zhou, S Li, L Gan, X Zhang, L Qi…",Hybrid computation offloading for smart home automation in mobile cloud computing,2017,Personal and Ubiquitous …,Springer,https://link.springer.com/article/10.1007/s00779-017-1095-0,,213
0,"J Zhao, S Ou, L Hu, Y Ding, G Xu",A heuristic placement selection approach of partitions of mobile applications in mobile cloud computing model based on community collaboration,2017,Cluster Computing,Springer,https://link.springer.com/article/10.1007/s10586-017-1011-4,,280
0,"JH Hur, SY Ihm, YH Park",A Variable Impacts Measurement in Random Forest for Mobile Cloud Computing,2017,Wireless Communications and Mobile …,hindawi.com,https://www.hindawi.com/journals/wcmc/2017/6817627/abs/,,165
3,"JK Mohsin, L Han, M Hammoudeh…","Two Factor Vs Multi-factor, an Authentication Battle in Mobile Cloud Computing Environments",2017,Proceedings of the …,dl.acm.org,https://dl.acm.org/citation.cfm?id=3102343,"https://scholar.google.com/scholar?cites=12770251758070040326&as_sdt=2005&sciodt=0,5&hl=en&num=20",83
48,"K Gai, L Qiu, M Chen, H Zhao, M Qiu",SA-EAST: security-aware efficient data transmission for ITS in mobile heterogeneous cloud computing,2017,ACM Transactions on Embedded …,dl.acm.org,https://dl.acm.org/citation.cfm?id=2979677,"https://scholar.google.com/scholar?cites=4965949515357998270&as_sdt=2005&sciodt=0,5&hl=en&num=20",4
1,"K Ko, Y Son, S Kim, Y Lee",DisCO: A distributed and concurrent offloading framework for mobile edge cloud computing,2017,Ubiquitous and Future Networks …,ieeexplore.ieee.org,http://ieeexplore.ieee.org/abstract/document/7993896/,"https://scholar.google.com/scholar?cites=9211483963483232584&as_sdt=2005&sciodt=0,5&hl=en&num=20",122
0,"K Lata, ES Sharma",A Review on Mobile Cloud Computing,2017,International Journal Of Engineering And Computer …,ijecs.in,https://www.ijecs.in/index.php/ijecs/article/view/2745,,116
0,"K Lata, S Sharma",A Survey on Cloud Computing and Mobile Cloud Computing,2017,,ijsrcseit.com,http://ijsrcseit.com/paper/CSEIT1723337.pdf,,158
0,"K Lata, S Sharma","Cloud Computing, Mobile Cloud Computing and Comparison between its Technologies",2017,,wjter.com,http://wjter.com/Research%20Papers/December%202017/PDF/Cloud%20Computing%2C%20Mobile%20Cloud%20Computing%20and%20Comparison%20between%20its%20Technologies.pdf,,168
0,"K Ravichandran, SS Kumar, S Kavinhariharasudhan",A NOVEL PROPOSAL FOR DATA SECURITY IN MOBILE CLOUD COMPUTING BY MUTUAL CRYPTOGRAPHIC SCHEMES,2017,,acadpubl.eu,http://acadpubl.eu/jsi/2017-116-23-24/articles/23/55.pdf,,225
0,"K Sindhu, HS Guruprasad",An Experimental Analysis on Performance and Energy Saving in Mobile Cloud Computing,2017,,researchgate.net,https://www.researchgate.net/profile/H_S_Guruprasad/publication/319313338_An_Experimental_Analysis_on_Performance_and_Energy_Saving_in_Mobile_Cloud_Computing/links/59a3b8bb458515fd1ff747f3/An-Experimental-Analysis-on-Performance-and-Energy-Saving-in-Mobile-Cloud-Computing.pdf,,136
5,"K Zhou, MH Afifi, J Ren",ExpSOS: Secure and verifiable outsourcing of exponentiation operations for mobile cloud computing,2017,IEEE Transactions on Information …,ieeexplore.ieee.org,http://ieeexplore.ieee.org/abstract/document/7937952/,"https://scholar.google.com/scholar?cites=17012394238960496967&as_sdt=2005&sciodt=0,5&hl=en&num=20",59
0,"KK Nguyen, DT Hoang, D Niyato, P Wang…",Cyberattack Detection in Mobile Cloud Computing: A Deep Learning Approach,2017,arXiv preprint arXiv …,arxiv.org,https://arxiv.org/abs/1712.05914,,135
2,"KS Arvind, R Manimegalai",Secure data classification using superior naive classifier in agent based mobile cloud computing,2017,Cluster Computing,Springer,https://link.springer.com/article/10.1007/s10586-017-0797-4,"https://scholar.google.com/scholar?cites=18063730975978099657&as_sdt=2005&sciodt=0,5&hl=en&num=20",73
0,"L Fu, YIN Xiaoyu",Lightweight application integration for mobile cloud computing,2017,"US Patent 9,781,065",Google Patents,https://patents.google.com/patent/US9781065B2/en,,244
0,"L Kou, Y Yuan, J Sun, Y Lin",Prediction of Cancer Based on Mobile Cloud Computing and SVM,2017,Dependable Systems and Their …,ieeexplore.ieee.org,https://ieeexplore.ieee.org/abstract/document/8269604/,,214
0,"L Ramavathu, M Bairam, S Manchala",A Framework for Secure Mobile Cloud Computing,2017,Proceedings of the First …,Springer,https://link.springer.com/chapter/10.1007/978-981-10-2471-9_34,,239
0,"L Siwik, D Kala, M Godzik, W Turek…",Mobile Cloud for Parallel and Distributed Green Computing,2017,Journal of …,yadda.icm.edu.pl,https://yadda.icm.edu.pl/baztech/session.action?userAction=property&parameterName=search%2FshowAbstract&parameterValue=false&currentUrl=%2Fbaztech%2Felement%2Fbwmeta1.element.baztech-dac995bf-2e63-4a35-8d2e-5637c4588d0a&currentApplicationPath=%2Felement%2Fbwmeta1.element.baztech-dac995bf-2e63-4a35-8d2e-5637c4588d0a&selectResultsNumber=20,,321
0,"L Xiong, D Peng, T Peng, H Liang",An Enhanced Privacy-Aware Authentication Scheme for Distributed Mobile Cloud Computing Services.,2017,KSII Transactions on Internet & …,itiis.org,"http://www.itiis.org/digital-library/manuscript/file/1889/TIIS+Vol+11,+No+12-26.pdf",,195
6,"LA Tawalbeh, F Ababneh…",Trust delegation-based secure mobile cloud computing framework,2017,… of Information and …,inderscienceonline.com,https://www.inderscienceonline.com/doi/abs/10.1504/IJICS.2017.082838,"https://scholar.google.com/scholar?cites=2626591034207961923&as_sdt=2005&sciodt=0,5&hl=en&num=20",20
11,"LW Chen, YF Ho, WT Kuo…",Intelligent file transfer for smart handheld devices based on mobile cloud computing,2017,International Journal of …,Wiley Online Library,http://onlinelibrary.wiley.com/doi/10.1002/dac.2947/full,"https://scholar.google.com/scholar?cites=7079884364061761231&as_sdt=2005&sciodt=0,5&hl=en&num=20",7
3,"M Akter, FT Zohra, AK Das",Q-MAC: QoS and mobility aware optimal resource allocation for dynamic application offloading in mobile cloud computing,2017,"Electrical, Computer and …",ieeexplore.ieee.org,http://ieeexplore.ieee.org/abstract/document/7913013/,"https://scholar.google.com/scholar?cites=831145746670451248&as_sdt=2005&sciodt=0,5&hl=en&num=20",119
0,"M Al-Ahmad, A Salah",Penetration testing model for mobile cloud computing applications/Ahmad Salah Mahmoud Al-Ahmad,2017,,"Institute of Graduate Studies, UiTM",,,318
1,"M Al-Rousan, E Al-Shara…",Cloudlet-based ad hoc mobile cloud computing: design and evaluation,2017,International …,inderscienceonline.com,https://www.inderscienceonline.com/doi/abs/10.1504/IJES.2017.086727,"https://scholar.google.com/scholar?cites=2477419334871976706&as_sdt=2005&sciodt=0,5&hl=en&num=20",188
1,"M Dai, D Liu, Y Fan, H Wang, X Lin, B Chen…",Evolutionary study on mobile cloud computing,2017,Neural Computing and …,Springer,https://link.springer.com/article/10.1007/s00521-016-2217-8,"https://scholar.google.com/scholar?cites=13868628515213098197&as_sdt=2005&sciodt=0,5&hl=en&num=20",81
3,"M Goudarzi, M Zamani, AT Haghighat",A fast hybrid multi-site computation offloading for mobile cloud computing,2017,Journal of Network and Computer …,Elsevier,https://www.sciencedirect.com/science/article/pii/S1084804516303514,"https://scholar.google.com/scholar?cites=3723544989509747949&as_sdt=2005&sciodt=0,5&hl=en&num=20",50
2,"M Goudarzi, M Zamani…",A genetic‐based decision algorithm for multisite computation offloading in mobile cloud computing,2017,International Journal of …,Wiley Online Library,http://onlinelibrary.wiley.com/doi/10.1002/dac.3241/full,"https://scholar.google.com/scholar?cites=13208779368163448141&as_sdt=2005&sciodt=0,5&hl=en&num=20",48
1,"M Hasan, MH Riaz, MA Rahman",Authentication Techniques in Cloud and Mobile Cloud Computing,2017,IJCSNS,paper.ijcsns.org,http://paper.ijcsns.org/07_book/201711/20171104.pdf,"https://scholar.google.com/scholar?cites=10195156652901560687&as_sdt=2005&sciodt=0,5&hl=en&num=20",254
25,"M Ibtihal, N Hassan",Homomorphic encryption as a service for outsourced images in mobile cloud computing environment,2017,… of Cloud Applications and Computing (IJCAC …,igi-global.com,https://www.igi-global.com/article/homomorphic-encryption-as-a-service-for-outsourced-images-in-mobile-cloud-computing-environment/179536,"https://scholar.google.com/scholar?cites=17609642932729772648&as_sdt=2005&sciodt=0,5&hl=en&num=20",8
0,"M Lyu, X Li, H Li","Efficient, Verifiable and Privacy Preserving Decentralized Attribute-Based Encryption for Mobile Cloud Computing",2017,"Data Science in Cyberspace (DSC), 2017 …",ieeexplore.ieee.org,http://ieeexplore.ieee.org/abstract/document/8005475/,,238
0,"M Masoudi, C Cavdar",Cloud vs Edge Computing for Mobile Services: Delay-aware Decision Making to Minimize Energy Consumption,2017,arXiv preprint arXiv:1711.03771,arxiv.org,https://arxiv.org/abs/1711.03771,,303
0,"M Otomo, K Hashimoto, N Uchida…",Mobile cloud computing usage for onboard vehicle servers in collecting disaster data information,2017,… and Technology (iCAST …,ieeexplore.ieee.org,https://ieeexplore.ieee.org/abstract/document/8256504/,,182
0,"M Qiu, K Gai","Mobile Cloud Computing: Models, Implementation, and Security",2017,,books.google.com,https://books.google.com/books?hl=en&lr=&id=1inZDgAAQBAJ&oi=fnd&pg=PT13&dq=+%22mobile+cloud+computing%22&ots=3fphZmA7Gl&sig=UPLKfcdf7NiwVrnr70bvMc4IW2s,,236
0,"M Sarvabhatla, S Konda, CS Vorugunti…",A Network Aware Energy Efficient Offloading Algorithm for Mobile Cloud Computing over 5G Network,2017,Cloud Computing in …,ieeexplore.ieee.org,https://ieeexplore.ieee.org/abstract/document/8332558/,,115
0,"M Sharma, P Bhopi","STUDY ON MOBILE CLOUD COMPUTING, IT'S ARCHITECTURE, CHALLENGES AND VARIOUS TRENDS",2017,,irjet.net,https://irjet.net/archives/V4/i6/IRJET-V4I6216.pdf,,174
0,"M Shiraz, A Gani, R Khokhar, A Rahman…",A Distributed and Elastic Application Processing Model for Mobile Cloud Computing,2017,Wireless Personal …,Springer,https://link.springer.com/article/10.1007/s11277-017-4086-6,,137
0,"M Sneps-Sneppe, D Namiot",On context-aware proxy in Mobile Cloud computing for emergency services,2017,"Telecommunications (ICT), 2017 …",ieeexplore.ieee.org,http://ieeexplore.ieee.org/abstract/document/7998286/,,107
16,"M Sookhak, FR Yu, MK Khan, Y Xiang…",Attribute-based data access control in mobile cloud computing: Taxonomy and open issues,2017,Future Generation …,Elsevier,https://www.sciencedirect.com/science/article/pii/S0167739X16302795,"https://scholar.google.com/scholar?cites=4272689028636667475&as_sdt=2005&sciodt=0,5&hl=en&num=20",21
1,"M Suguna, R Anusia, SM Shalinie…",Secure identity management in mobile cloud computing,2017,… Technologies: Silicon to …,ieeexplore.ieee.org,http://ieeexplore.ieee.org/abstract/document/8067894/,"https://scholar.google.com/scholar?cites=5900562279019271452&as_sdt=2005&sciodt=0,5&hl=en&num=20",138
0,"M Suguna, SM Shalinie",Privacy preserving data auditing protocol for secure storage in mobile cloud computing,2017,"Wireless Communications, Signal …",ieeexplore.ieee.org,https://ieeexplore.ieee.org/abstract/document/8300258/,,246
1,"M Umar, J Ferzund, T Sajjad, SM Owais",Dealing Issues of Mobile Cloud Computing using 5G Technology,2017,IJCSNS,paper.ijcsns.org,http://paper.ijcsns.org/07_book/201708/20170832.pdf,"https://scholar.google.com/scholar?cites=7768608849369842968&as_sdt=2005&sciodt=0,5&hl=en&num=20",69
0,"MA Alkubati, SA Aljunid, NK Ismail",An Architecture for Providing Context-Aware Security as a Service in Mobile Cloud Computing Environments,2017,Advanced Science Letters,ingentaconnect.com,http://www.ingentaconnect.com/contentone/asp/asl/2017/00000023/00000011/art00140,,132
0,"MA Culman, JA Gomez, J Talavera…","Proceedings-5th IEEE International Conference on Mobile Cloud Computing, Services, and Engineering, MobileCloud 2017",2017,…,colciencias.pure.elsevier.com,https://colciencias.pure.elsevier.com/en/publications/proceedings-5th-ieee-international-conference-on-mobile-cloud-com,,193
0,"MA Meshkani, MH Yousefi, MJ Rashidi",Partitioning mobile application by cloud computing using a linear programming algorithm in the graph,2017,Revista QUID,revistas.proeditio.com,http://revistas.proeditio.com/iush/quid/article/view/1824,,300
0,"MA MOHAMMED, N ŢĂPUŞ",A Novel Approach of Reducing Energy Consumption by Utilizing Enthalpy in Mobile Cloud Computing,2017,Studies in Informatics and Control,sic.ici.ro,https://sic.ici.ro/wp-content/uploads/2017/12/SIC_2017-4-Art.6.pdf,,270
0,MA Shalan,Considering Middle Circles in Mobile Cloud Computing: Ethics and Risk Governance,2017,Security Management in Mobile Cloud Computing,igi-global.com,https://www.igi-global.com/chapter/considering-middle-circles-in-mobile-cloud-computing/162009,,140
22,"MB Mollah, MAK Azad, A Vasilakos",Security and privacy challenges in mobile cloud computing: Survey and way ahead,2017,Journal of Network and Computer …,Elsevier,https://www.sciencedirect.com/science/article/pii/S1084804517300632,"https://scholar.google.com/scholar?cites=1298563604741970568&as_sdt=2005&sciodt=0,5&hl=en&num=20",13
0,MH Chen,Joint Task Offloading and Resource Allocation for Mobile Cloud with Computing Access Point,2017,,tspace.library.utoronto.ca,https://tspace.library.utoronto.ca/handle/1807/80918,,305
10,"MH Chen, B Liang, M Dong",Joint offloading and resource allocation for computation and communication in mobile cloud with computing access point,2017,INFOCOM 2017-IEEE Conference …,ieeexplore.ieee.org,http://ieeexplore.ieee.org/abstract/document/8057150/,"https://scholar.google.com/scholar?cites=7285204860804070588&as_sdt=2005&sciodt=0,5&hl=en&num=20",37
0,MJ Rishi,Cost Effective Resource Allocation in C-RAN with Mobile Cloud Computing,2017,International Journal Of Engineering And Computer …,ijecs.in,https://www.ijecs.in/index.php/ijecs/article/view/2317,,159
0,MM Kirmani,Integrated approach for efficient mobile application development using Cloud Computing and Green SDLC: A Study,2017,International Journal of Advanced Research in …,search.proquest.com,http://search.proquest.com/openview/805db55fd608769d2cca313b0ec303fe/1?pq-origsite=gscholar&cbl=1606379,,293
0,"MM Kumar, R Vijayan",Privacy authentication using key attribute-based encryption in mobile cloud computing,2017,IOP Conference Series: Materials …,iopscience.iop.org,http://iopscience.iop.org/article/10.1088/1757-899X/263/4/042069/meta,,104
0,"MNP Ganatra, MRS Patel",Proposed Customized Architecture of Mobile Cloud Computing in Health Care Domain,2017,… Journal of Advanced Research in Computer …,ijarcs.info,http://ijarcs.info/index.php/Ijarcs/article/view/3467,,200
0,MT Appl,Editorial Note: Multimedia Service and Applications with Mobile Cloud Computing,2017,,Springer,https://link.springer.com/article/10.1007/s11042-017-4972-7,,215
0,"N Rajyaguru, M Vinay",A Comparative Study of Big Data on Mobile Cloud Computing,2017,Indian Journal of Science and Technology,indjst.org,http://www.indjst.org/index.php/indjst/article/viewFile/109290/80297,,207
0,"N Sinha, SB Sharma, P Prashar",Mobile cloud computing: The future essence,2017,… and Aerospace Technology …,ieeexplore.ieee.org,https://ieeexplore.ieee.org/abstract/document/8203632/,,124
0,"NS Hussien, S Sulaiman",Web Pre-fetching Schemes using Machine Learning for Mobile Cloud Computing,2017,Int. J. Advance Soft Compu …,pdfs.semanticscholar.org,https://pdfs.semanticscholar.org/5fb0/0dce563b586b7f8cd2a8f85ae815c2ad923f.pdf,,161
3,"NT Ti, LB Le",Computation offloading leveraging computing resources from edge cloud and mobile peers,2017,"… (ICC), 2017 IEEE International Conference on",ieeexplore.ieee.org,http://ieeexplore.ieee.org/abstract/document/7997138/,"https://scholar.google.com/scholar?cites=17806561878453527355&as_sdt=2005&sciodt=0,5&hl=en&num=20",95
1,"OP Akomolafe, MO Abodunrin",A Hybrid Cryptographic Model for Data Storage in Mobile Cloud Computing,2017,International Journal of …,search.proquest.com,http://search.proquest.com/openview/ab85d83129a1d0e680964c74fd546c46/1?pq-origsite=gscholar&cbl=2026671,"https://scholar.google.com/scholar?cites=9915266122827440598&as_sdt=2005&sciodt=0,5&hl=en&num=20",70
10,"P Gope, AK Das",Robust Anonymous Mutual Authentication Scheme for n-Times Ubiquitous Mobile Cloud Computing Services,2017,IEEE Internet of Things Journal,ieeexplore.ieee.org,http://ieeexplore.ieee.org/abstract/document/7970099/,"https://scholar.google.com/scholar?cites=3546417616848658490&as_sdt=2005&sciodt=0,5&hl=en&num=20",24
0,P Li,Design and implementation of medical cloud database service system based on parallel and mobile computing,2017,International Journal of Biomedical Engineering and …,inderscienceonline.com,https://www.inderscienceonline.com/doi/abs/10.1504/IJBET.2017.082663,,276
1,"P Nawrocki, B Sniezynski",Adaptive Service Management in Mobile Cloud Computing by Means of Supervised and Reinforcement Learning,2017,Journal of Network and Systems Management,Springer,https://link.springer.com/article/10.1007/s10922-017-9405-4,"https://scholar.google.com/scholar?cites=3258535922868058423&as_sdt=2005&sciodt=0,5&hl=en&num=20",183
1,"P Nawrocki, B Sniezynski",Autonomous Context-Based Service Optimization in Mobile Cloud Computing,2017,Journal of Grid Computing,Springer,https://link.springer.com/article/10.1007/s10723-017-9406-2,"https://scholar.google.com/scholar?cites=12584099173268207889&as_sdt=2005&sciodt=0,5&hl=en&num=20",185
6,"P Nawrocki, W Reszelewski",Resource usage optimization in mobile cloud computing,2017,Computer Communications,Elsevier,https://www.sciencedirect.com/science/article/pii/S0140366416306673,"https://scholar.google.com/scholar?cites=1707055863851725353&as_sdt=2005&sciodt=0,5&hl=en&num=20",17
0,"P PRIYA, SP SHANTHARAJAH",DYNAMIC ENERGY OPTIMIZATION TECHNIQUE IN MOBILE CLOUDLET FOR MOBILE CLOUD COMPUTING USING EFFECTIVE OFFLOADING ALGORITHM.,2017,Journal of Theoretical & …,search.ebscohost.com,http://search.ebscohost.com/login.aspx?direct=true&profile=ehost&scope=site&authtype=crawler&jrnl=19928645&AN=124018696&h=9YkCpf5QMXNpOUIvie9WIuBocPCKIPQzRcrln%2FYXwe13yfBtql4NZPkf9ZonH2cM%2FkIqQMj4Bx9npjQ%2Foq0ZoQ%3D%3D&crl=c,,243
0,"P Thanapal, MAS Durai",A framework for computational offloading to extend the energy of mobile devices in mobile cloud computing,2017,International Journal of …,inderscienceonline.com,https://www.inderscienceonline.com/doi/abs/10.1504/IJES.2017.086725,,252
0,"P Xiao, R Chen, X Qu",Improving security and energy-efficiency for cloud-based storage platforms in mobile computing environments,2017,International Journal of Information …,inderscienceonline.com,https://www.inderscienceonline.com/doi/abs/10.1504/IJICT.2017.084335,,310
0,"PK Paul, PS Aithal, A Bhuimali",Mobile Cloud Computing Vis-À-Vis Eco Friendliness for Sustainable Development,2017,,papers.ssrn.com,https://papers.ssrn.com/sol3/papers.cfm?abstract_id=3024723,,197
0,PMC Sanches,Distributed Computing in a Cloud of Mobile Phones,2017,,run.unl.pt,http://run.unl.pt/handle/10362/30063,,307
0,"PN Moya, JN Castillo, H Llamuca…",Mobile Cloud Computing-Google Cloud Messaging,2017,Revista Científica y …,incyt.upse.edu.ec,http://incyt.upse.edu.ec/revistas/index.php/rctu/article/view/226,,319
1,"PV Krishna, S Misra, V Saritha, DN Raju…",An efficient learning automata based task offloading in mobile cloud computing environments,2017,"… (ICC), 2017 IEEE …",ieeexplore.ieee.org,http://ieeexplore.ieee.org/abstract/document/7997139/,"https://scholar.google.com/scholar?cites=10697146580457091937&as_sdt=2005&sciodt=0,5&hl=en&num=20",184
0,"Q Ding, X Chen, Z Shi",A Novel Trust Management Framework for Mobile Cloud Computing Environment,2017,,pos.sissa.it,https://pos.sissa.it/299/070/pdf,,163
6,"Q Zou, J Wang, J Ye, J Shen, X Chen",Efficient and secure encrypted image search in mobile cloud computing,2017,Soft Computing,Springer,https://link.springer.com/article/10.1007/s00500-016-2153-7,"https://scholar.google.com/scholar?cites=17300843134420543975&as_sdt=2005&sciodt=0,5&hl=en&num=20",26
1,"QB Hani, JP Ditcher",Mobile-Based Location Tracking without Internet Connectivity Using Cloud Computing Environment,2017,"Mobile Cloud Computing, Services, and …",ieeexplore.ieee.org,http://ieeexplore.ieee.org/abstract/document/7944890/,"https://scholar.google.com/scholar?cites=13594257870763133845&as_sdt=2005&sciodt=0,5&hl=en&num=20",103
